{
  "run_id": "example_t_c02",
  "pack_id": "measuring_agents_in_production_a98e2ca8",
  "task_id": "t_c02",
  "created_at": "2025-12-23T21:00:00Z",
  "inputs": {
    "eval_artifacts": {
      "benchmarks": [],
      "ab_tests": ["ab_report_q4.json"],
      "user_feedback": ["feedback_summary.md"],
      "monitoring": ["dashboard_link_or_export.csv"]
    },
    "agent_description": "Incident triage assistant used by SREs; suggests remediation steps; humans approve execution.",
    "time_window": { "start": "2025-10-01", "end": "2025-12-01" }
  }
}
