{
  "run_id": "example_t_c04",
  "pack_id": "measuring_agents_in_production_a98e2ca8",
  "task_id": "t_c04",
  "created_at": "2025-12-23T21:00:00Z",
  "inputs": {
    "production_metrics_timeseries": [
      { "window_start": "2025-10-01", "window_end": "2025-10-07", "task_success_rate": 0.80, "override_rate": 0.20 },
      { "window_start": "2025-10-08", "window_end": "2025-10-14", "task_success_rate": 0.76, "override_rate": 0.24 },
      { "window_start": "2025-10-15", "window_end": "2025-10-21", "task_success_rate": 0.70, "override_rate": 0.30 }
    ],
    "baseline_metrics": { "task_success_rate": 0.80, "override_rate": 0.20 },
    "drift_policy": { "task_success_drop_pct": 0.10, "override_increase_pct": 0.10, "min_windows": 3 }
  }
}
